餐饮评论ID,城市,餐饮名称,评论日期,评论内容,标题,实体编码
4548,茂名,法兰度航空主题餐厅（东汇城店）,2021-04-29,ok,精品浪漫双人餐1份,OO
4549,茂名,贵族自助牛排餐厅（华侨城店）,2021-04-30,挺不错的一家牛排自助店，已经去过N次了。服务和环境都挺好，当然图片那些菜品都是限量提供的，手快有手慢无！最重要的一条用餐不限时。还有很多其他我非常爱吃的小吃，爆米花，他们家的烤热狗也非常不错不是那些便宜那种热狗。小吃有烫的，炸的，烤的，凉拌，炒的等等。,贵族自助牛排套餐，建议单人使用,OOOOOOBIOOOOOOOOOOOOOOOOOOOOOOOOOOOOOOOOOOOOOOOOOOOOOOOOOOOOOOOOOOOOOOOOOOOOOOOOOOOOOOOOBIOOOOOOOOOOOOOBIOOOOOOOOOOOOOOOOOOOOO
4550,茂名,满酱（东湖店）,2021-04-30,好吃,100元代金券1张，可叠加,OO
4551,茂名,遇见桃园烤鱼（新福路店）,2021-04-30,味道还可以，再稍微咸一点更好，环境比较舒适，约上好友，吹着空调听着歌吃着香喷喷的烤鱼，人间值得,桃园烤鱼抢购套餐，建议4人使用,OOOOOOOOOOOOOOOOOOOOOOOOOOOOOOOOOOOOOOOOOOOOOOO
4552,茂名,Hello炸鸡（方兴店）,2021-04-30,真就巨无敌好吃！！！！！！！！,30元代金券1张，可叠加,OOOOOOOOOOOOOOO
4553,茂名,椒王火锅（电白店）,2021-04-30,味道比以前吃的差了一点，重点是买单还买错了，又要我们回来,100元代金券1张，可叠加,OOOOOOOOOOOOOOOOOOOOOOOOOOOO
4554,茂名,贵族自助牛排餐厅（华侨城店）,2021-04-30,服务态度超级好,贵族自助牛排套餐，建议单人使用,OOOOOOO
4555,茂名,云南过桥米线（汇景店）,2021-04-30,环境挺不错的，挺好吃的，店家也不错,云南小锅米线1份,OOOOOOOOOOOOOOOOO
4556,茂名,优乐堡（开发区店）,2021-04-30,12块2个，还不错，买了好几次了,超抵鸡腿堡2个，建议单人使用,OOOOOOOOOOOOOOOO
4557,茂名,优乐堡（开发区店）,2021-04-30,便宜,超抵鸡腿堡2个，建议单人使用,OO
4558,茂名,付记·招牌酸菜鱼,2021-04-30,一言难尽，总之好坏相比也就一般般。,招牌酸菜鱼+香米饭1份，包间免费,OOOOOOOOOOOOOOOOO
4559,茂名,顺德火焰醉鹅坊（站北五路店）,2021-04-30,在很多地方吃过，这家味道还是很给力，一定还会回头，，，，，，，，，，，，，，，，，，，，，，，，，，，，，，，，，，，，，，，，，，，，，，，，，，，，，，，，，，，，，，，，，，，，，，，，，，，，，，,3-4人火锅套餐,OOOOOOOOOOOOOOOOOOOOOOOOOOOOOOOOOOOOOOOOOOOOOOOOOOOOOOOOOOOOOOOOOOOOOOOOOOOOOOOOOOOOOOOOOOOOOOOOOOOOOO
4560,茂名,付记·招牌酸菜鱼,2021-04-30,口感不错，这次点的是有刺的，下次要去品尝一下没刺的,招牌酸菜鱼+香米饭1份，包间免费,OOOOOOOOOOOOOOOOOOOOOOOOO
4561,茂名,小乔紫菜卷（小乔店）,2021-04-30,怎么这家店是看不起美团的吗？我用的是美团抢购2.8元秒杀一份紫菜肉松卷，我前后去了三次他才给我兑换，第一次去说没手机扫不了码，第二次说摄像头坏了扫不了，第三次终于摆个臭脸帮我扫了，还说做我的亏本生意，不是吧老板，每天的秒杀都有你家店，不想上秒杀就别上啊，买了又不肯换，不想做就早点关门，我真没见过这样做生意的，我抢了三块钱的奶茶人家也都对我好声好气，你这店还歧视消费者？对了你故意在美团买的紫菜卷用硬米，吃得臭臭的，就不怕人家吃出问题找上你？,紫菜肉松卷1份，提供免费WiFi,OOOOOOOOOOOOOOOOOOOOOOOOOOOOOOOOBIOOOOOOOOOOOOOOOOOOOOOOOOOOOOOOOOOOOOOOOOOOOOOOOOOOOOOOOOOOOOOOOOOOOOOOOOOOOOOOOOOOOOOOOOOOOOOOOOOOOOOOOOOOOOOOOOOOOOOOOOOOOOOOOOOOOOOOOOOOOOOOOOOOOOOOOOOOOOOOOOOOOOOOOOOOOOOOOOOOOOOOOOOOO
4562,茂名,冲天香鸭粥店（光华北店）,2021-04-30,好吃，三个人吃都没问题，好饱。,2-3人鸭粥套餐,OOOOOOOOOOOOOOO
4563,茂名,冲天香鸭粥店（光华北店）,2021-04-30,个别服务员态度非常差 拽的跟二五八万似的 来吃饭仿佛是欠她的 这家店不是第一次去 但是绝对是最后一次去,2-3人鸭粥套餐,OOOOOOOOOOOOOOOOOOOOOOOOOOOOOOOOOOOOOOOOOOOOOOOOOOO
4564,茂名,十七门重庆老火锅（电白万达店）,2021-04-30,还行吧，那个小酥肉挺好吃的，那个鸭肠份量很足，肥牛可以,100元代金券1张，可叠加2张,OOOOOOOOOOOOOOOOOOOOOOOOOOO
4565,茂名,法兰度航空主题餐厅（东汇城店）,2021-04-30,味道很好，环境不错，下次还来。,精品浪漫双人餐1份,OOOOOOOOOOOOOOO
4566,茂名,菠斯蒂蛋糕,2021-04-30,好吃，真的很推荐榴莲千层，真的很好吃,榴莲千层1份，提供免费WiFi,OOOOOOOOBIIIOOOOOO
4567,茂名,菠斯蒂蛋糕,2021-04-30,榴莲千层好吃,榴莲千层1份，提供免费WiFi,BIIIOO
4568,茂名,遇见桃园烤鱼（新福路店）,2021-05-01,分量挺足的，口味就差点，香辣味，一点都不辣，就是很失望，看着好像很辣的样子，其实一点都不辣。别的都还好,桃园烤鱼抢购套餐，建议4人使用,OOOOOOOOOOOOOOOOOOOOOOOOOOOOOOOOOOOOOOOOOOOOOOOOOOO
4569,茂名,油校西餐厅（光遇·油校光华校区店）,2021-05-01,环境干净整洁、口味也很好，上菜也挺快的，黑椒鸡扒的酱真的超好吃，宿舍五个女生去的，两个双人餐加一个单人餐，分量真的很多，有的吃不完打包回去了。PS：如果不是油校的学生也可以走餐厅的小门进来。总之很推荐啦！,单人黑椒鸡扒套餐,OOOOOOOOOOOOOOOOOOOOOOOOOOOOOOOOOOOOOOOOOOOOOOOOOOOOOOOOOOOOOOOOOOOOOOOOOOOOOOOOOOOOOOOOOOOOOOOOOOOOOO
4570,茂名,贵族自助牛排餐厅（华侨城店）,2021-05-01,#套餐：单人贵族自助牛排套餐#套餐：单人贵族自助牛排套餐#套餐：单人贵族自助牛排套餐#套餐：单人贵族自助牛排套餐#套餐：单人贵族自助牛排套餐#套餐：单人贵族自助牛排套餐自助的菜是真的超级超级少，不过不定时有小龙虾跟皮皮虾还有一个不知道是不是叫花甲粉丝，反正我只吃到了小龙虾，一般般吧！,贵族自助牛排套餐，建议单人使用,OOOOOOOOOOBIOOOOOOOOOOOOBIOOOOOOOOOOOOBIOOOOOOOOOOOOBIOOOOOOOOOOOOBIOOOOOOOOOOOOBIOOOOOOOOOOOOOOOOOOOOOOOOOOOOOOOOOOOOOOOOOOOOOOOOOOOOOOOOOOOO
4571,茂名,椒王火锅（电白店）,2021-05-01,实话实说还蛮一般的 我那次去吃居然看到有飞虫在桌子上爬  不过这个问题对于餐饮业来说是致命的但是也是常见的 希望商家在这方面做好一点吧,100元代金券1张，可叠加2张,OOOOOOOOOOOOOOOOOOOOOOOOOOOOOOOOOOOOOOOOOOOOOOOOOOOOOOOOOOOOOOOOOOO
4572,茂名,贵族自助牛排餐厅（华侨城店）,2021-05-01,强烈推荐，来过很多次了，每次都不错，从来没有失望过。,贵族自助牛排套餐，建议单人使用,OOOOOOOOOOOOOOOOOOOOOOOOOO
4573,茂名,贵族自助牛排餐厅（华侨城店）,2021-05-01,很好！第一次过来。还不错,贵族自助牛排套餐，建议单人使用,OOOOOOOOOOOO
4574,茂名,优乐堡（开发区店）,2021-05-01,此次用餐总体来说不错，觉得比较认可的地方有：口味、团购接待、环境、性价比、服务。,汉堡+鸡腿套餐，建议单人使用,OOOOOOOOOOOOOOOOOOOOOOOOOOOOOOOOOOOOOOOO
4575,茂名,优乐堡（开发区店）,2021-05-01,好吃不贵，我是常客，每周都会吃优乐堡，老顾客了,超值汉堡单人餐，提供免费WiFi,OOOOOOOOOOOOOOOOOOOOOOO
4576,茂名,顺德火焰醉鹅坊（站北五路店）,2021-05-01,味道不错，分量很足，美团买的套餐,6人套餐，提供免费WiFi,OOOOOOOOOOOOOOOO
4577,茂名,顺德火焰醉鹅坊（站北五路店）,2021-05-01,味道还行，三个人量不少，可以吃饱饱了。,3-4人火锅套餐,OOOOOOOOOOOOOOOOOOO
4578,茂名,顺德火焰醉鹅坊（站北五路店）,2021-05-01,整体体评价的话我觉得还行,6人套餐，提供免费WiFi,OOOOOOOOOOOO
4579,茂名,遇见桃园烤鱼（新福路店）,2021-05-01,环境挺好的，性价比很高。，服务态度也很好。，就是我觉得有点点淡， 反正挺值的。,桃园烤鱼抢购套餐，建议4人使用,OOOOOOOOOOOOOOOOOOOOOOOOOOOOOOOOOOOOOOO
4580,茂名,遇见桃园烤鱼（新福路店）,2021-05-02,鱼真的很大，不用担心四个人不够吃（根本吃不完）味道很赞，但是太咸了点（我喜欢清淡点的，看个人口味吧）吃不完打包态度也很好！！！！！爱了爱了，下次再来,桃园烤鱼抢购套餐，建议4人使用,OOOOOOOOOOOOOOOOOOOOOOOOOOOOOOOOOOOOOOOOOOOOOOOOOOOOOOOOOOOOOOOOOOOOOOOOOO
4581,茂名,贵族自助牛排餐厅（华侨城店）,2021-05-02,味道还算可以，服务很好！小姐姐很热情！就是上菜更新菜品有点慢了，可能是人太多了！小龙虾，扇贝什么的一上来就被抢光了！第一次遇到这种吃饭跟打仗一样的！唯一不好的就是，我们在桌子坐着用餐，有个客人跑进来问我们这里牛排收费不，怎么怎么的，我又不是老板更不是这的服务员！而且说话也跟拽！又不戴口罩，希望商家以后可以注意下这方面的问题！,贵族自助牛排套餐，建议单人使用,OOOOOOOOOOOOOOOOOOOOOOOOOOOOOOOOOOOOOOOOOOOOOOOOOOOOOOOOOOOOOOOOOOOOOOOOOOOOOOOOOOOOOOOOOOOOOOOOOOOOOOOOBIOOOOOOOOOOOOOOOOOOOOOOOOOOOOOOOOOOOOOOOOOOOOOOOOOOOOOOOOO
4582,茂名,遇见桃园烤鱼（新福路店）,2021-05-02,属于休闲两三人的地方，环境还行，味道不错。团购价格很好,桃园烤鱼抢购套餐，建议4人使用,OOOOOOOOOOOOOOOOOOOOOOOOOOO
4583,茂名,Hello炸鸡（方兴店）,2021-05-02,奶茶超级好喝，贴纸 也很好看，因为不是还喜欢那个笑脸，然后姐姐给我换了一个，超级好,杰伦同款奶茶2选1,OOOOOOOOOOOOOOOOOOOOOOOOOOOOOOOOOOOOOOOOO
4584,茂名,贵族自助牛排餐厅（华侨城店）,2021-05-02,#套餐：单人贵族牛排高级套餐先说优点吧，牛排很好吃，很嫩。缺点就。。。【性价比】不高，不值，东西都是一些比较廉价的，肉类很少，就鸡肉，鸡翅，鱼，糕点水果跟寿司，素类比较多。有一盘生蚝，端出来一分钟不到就没了，很多人都拿不到。【口味】一般，还可以，这个价钱，要啥自行车。【服务】没得说，挺好的，用过的餐具啥收的也勤快。【环境】还是不错的。总的来说，奔着吃肉的可以趁早改主意了。,贵族牛排高级套餐，建议单人使用,OOOOOOOOBIOOOOOOOOOOBIOOOOOOOOOOOOOOOOOOOOOOOOOOOOOOOOOOOOOOOOOOOOOOOOOOOOOOOBIOOOOOOOOOOBIOOOOOOOOOOOOOOOOOOOOOOOOOOOOOOOOOOOOOOOOOOOOOOOOOOOOOOOOOOOOOOOOOOOOOOOOOOOOOOOOOOOOOOOOOOOOOOOO
4585,茂名,Hello炸鸡（方兴店）,2021-05-02,没来的急拍照就吃完了，味道不错爱了爱了，老板服务超级好，是打包回去吃的，因为急着去玩，下次试试堂食，还有其他口味也觉得很好吃,韩式炸鸡7选1，提供免费WiFi,OOOOOOOOOOOOOOOOOOOOOOOOOOOOOOOOOOOOOOOOOOOOOOOOOOOOOOOOOOOOOO
4586,茂名,油校西餐厅（光遇·油校光华校区店）,2021-05-02,#套餐：双人鸡扒套餐鸡扒好多油但是味道还行，海鲜饭几乎都是鱼蛋类，可能是我把海鲜饭这个名字有点误会了吧,双人鸡扒套餐，提供免费WiFi,OOOOOOOOOOOOOOOOOOOOOOBIOOOOOOOOOOOOOOBIOOOOOOOOOOO
4587,茂名,贵族自助牛排餐厅（华侨城店）,2021-05-02,很奈斯的一次消费啦  因为是五一  来的比较晚了  吃的不多  最后小姐姐送来了两个小玩偶  很可爱  小姐姐也很可爱很辛苦,贵族自助牛排套餐，建议单人使用,OOOOOOOOOOOOOOOOOOOOOOOOOOOOOOOOOOOOOOOOOOOOOOOOOOOOOOOOOOOOOO
4588,茂名,草原郎烤羊,2021-05-02,非常好吃，羊肉味道很足。下次还来。很大串，反正都好好吃。,100元代金券1张,OOOOOOOOOOOOOOOOOOOOOOOOOOOO
4589,茂名,贵族自助牛排餐厅（华侨城店）,2021-05-02,环境不仅不错，价格还很实惠，和自助结合在一起简直不要太好,贵族自助牛排套餐，建议单人使用,OOOOOOOOOOOOOOOOOOOOOOOOOOOO
4590,茂名,贵族自助牛排餐厅（华侨城店）,2021-05-02,第N次来了，味道非常好，今晚继续到场，等我……3位哈。,贵族自助牛排套餐，建议单人使用,OOOOOOOOOOOOOOOOOOOOOOOOOOO
4591,茂名,贵族自助牛排餐厅（华侨城店）,2021-05-02,海鲜样式和量够足,贵族自助牛排套餐，建议单人使用,BIOOOOOO
4592,茂名,爵士厚牛排自助餐馆（汇丰店）,2021-05-02,菜品不错，值得推荐，周末菜品相对多一些，若平常不知道吃什么可以到那里吃。,全部菜品2选1，有赠品,OOOOOOOOOOOOOOOOOOOOOOOOOOOOOOOOOOOO
4593,茂名,相聚时光（化州店）,2021-05-02,扒还不错，但是性价比不高，服务什么的我不多说了，去了好久都没有来人，环境当然是好的,单人扒餐，提供免费WiFi,OOOOOOOOOOOOOOOOOOOOOOOOOOOOOOOOOOOOOOOOO
4594,茂名,友情有意音乐餐厅,2021-05-02,超级好吃的，每次基本都会点麻婆豆腐,超值滑饭饮品套餐，建议单人使用,OOOOOOOOOOOOOOOOO
4595,茂名,友情有意音乐餐厅,2021-05-02,环境还不错，烤鱼很便宜，就是有点辣,温馨烤鱼宵夜套餐，建议2人使用,OOOOOOOOOOOOOOOOO
4596,茂名,汉宫传承隆江猪脚饭（上排垌店）,2021-05-02,此次用餐总体来说不错，觉得比较认可的地方有：性价比。,招牌猪脚饭1份，提供免费WiFi,OOOOOOOOOOOOOOOOOOOOOOOOOO
4597,茂名,汉宫传承隆江猪脚饭（上排垌店）,2021-05-02,正宗隆江猪脚饭，水东吃过最好吃的了,招牌猪脚饭1份，提供免费WiFi,OOOOOOOOOOOOOOOOO
4598,茂名,冲天香鸭粥店（光华北店）,2021-05-02,这个套餐的煎鱼特别好吃,招牌冲天香鸭杂，建议2-3人使用,OOOOOOOOOOO
4599,茂名,汉宫传承隆江猪脚饭（上排垌店）,2021-05-02,多次消费了，味道不错，环境不错,主食2选1，提供免费WiFi,OOOOOOOOOOOOOOO
4600,茂名,汉宫传承隆江猪脚饭（上排垌店）,2021-05-02,好的好的谢谢啦！好好吃饭吧！！,主食2选1，提供免费WiFi,OOOOOOOOOOOOOOO
4601,茂名,御品豆花（宾南路店）,2021-05-02,芋圆很糯很好吃，豆花也不会太甜，分量很足够！环境很好，店里面还有很多种类糖水选择，很齐全！老板服务态度可以，不会因为美团买的区别对待，分量一样很多！点了两碗豆花芋圆糖水，美滋滋。下次回家还会光顾的！！！,三色芋圆豆腐花1份,OOOOOOOOOOOOOOOOOOOOOOOOOOOOOOOOOOOOOOOOOOOOOOOOOOOOOOOOOOOOOOOOOOOOOOOOOOOOOOOOOOOOOOOOOOOOOOOOOOOOO
4602,茂名,贵族自助牛排餐厅（华侨城店）,2021-05-02,我是五一当天8.30左右去的，那个时候真的非常忙，一开始没有服务理我们，或者说两句话就走了根本找不到人，而且也没有多少东西吃了，最后我们牛排上来的时候已经9点多了，看到隔壁桌有海鲜我们问了一下哪有，人家说刚出来就没有了哈哈哈哈哈笑死了，没办法我们太佛了，随便吃吃就算啦，后来快打烊的时候服务人员姐姐送了我们两个玩偶，太可爱了，今天最快乐的事情就是收到两个小玩偶礼物了，有一点点惊喜，服务姐姐和我们讲今天有点忙没顾得过来我们感到非常抱歉，说是我们下次过来可以提前过来，其实没啥，我们吃饭是为了活着哈哈哈哈哈，谢谢小姐姐，服务很好，老板也很好，很会照顾客人情绪，但其实我们没啥，五一假期人多很正常，希望下次去能吃上小龙虾，因为我就是冲着小龙虾去的哈哈哈哈哈，祝餐厅的各位宝贝假期快乐叭！,贵族自助牛排套餐，建议单人使用,OOOOOOOOOOOOOOOOOOOOOOOOOOOOOOOOOOOOOOOOOOOOOOOOOOOOOOOOOOOOOOOOOOOOBIOOOOOOOOOOOOOOOOOOBIOOOOOOOOOOOOOOOOOOOOOOOOOOOOOOOOOOOOOOOOOOOOOOOOOOOOOOOOOOOOOOOOOOOOOOOOOOOOOOOOOOOOOOOOOOOOOOOOOOOOOOOOOOOOOOOOOOOOOOOOOOOOOOOOOOOOOOOOOOOOOOOOOOOOOOOOOOOOOOOOOOOOOOOOOOOOOOOOOOOOOOOOOOOOOOOOOOOOOOOOOOOOOOOOOOOOOOOOOOOOOOOOOOOOOOOOOOOOOOOOOOOOOOOOOOO
4603,茂名,十七门重庆老火锅（电白万达店）,2021-05-02,不错,100元代金券1张，可叠加2张,OO
4604,茂名,遇见桃园烤鱼（新福路店）,2021-05-03,不知是否因为用的是美团券，扫码至餐后没人上茶水！等餐等到娃饿的哇哇哭，而且周围餐桌比我来得晚很多的都已上完，我的还得自己去催促！这区别对待太明显了！心凉了？,桃园烤鱼抢购套餐，建议4人使用,OOOOOOOOOOOOOOOOOOOOOOOOOOOOOOOOOOOOOOOOOOOOOOOOOOOOOOOOOOOOOOOOOOOOOOOOOOOOOO
4605,茂名,贵族自助牛排餐厅（华侨城店）,2021-05-03,自认为是吃了那么多自助餐最好吃，最多品种，最优惠的了，物美价廉，而且店里有位员工无论态度还是服务特别好，这是其它店没有的，值得推荐，#套餐：单人贵族自助牛排套餐并且菜系持续更新，真材实料，无限时无限量,贵族自助牛排套餐，建议单人使用,OOOOOOOOOOOOOOOOOOOOOOOOOOOOOOOOOOOOOOOOOOOOOOOOOOOOOOOOOOOOOOOOOOOOOOOOOOOOBIOOOOOOOOOOOOOOOOOOOOOO
4606,茂名,LINLEE·手打柠檬茶（文创店）,2021-05-03,此次用餐总体来说不错，觉得比较认可的地方有：口味、服务、环境、性价比、团购接待。,鄰里招牌柠檬茶2选1,OOOOOOOOOOOOOOOOOOOOOOOOOOOOOOOOOOOOOOOO
4607,茂名,贵族自助牛排餐厅（华侨城店）,2021-05-03,还行，挺划算的套装，佛过得比飞机次即可洗净,贵族自助牛排套餐，建议单人使用,OOOOOOOOOOOOOOOOOOOOO
4608,茂名,螺香汇·柳州螺蛳粉（官渡二路油校店）,2021-05-03,花生米不新鲜，喜欢空心菜，酸豆角不喜欢，因为头顶上有风扇，一直有虫子掉下来，还掉在碗里，佛了，呜呜呜呜呜呜呜,原味螺蛳粉（粗粉/米线/面条 三选一）1份,OOOOOOOOOOOOOOOOOOOOOOOOOOOOOOOOOOOOOOOOOOOOOOOOOOOOOO
4609,茂名,付记·招牌酸菜鱼,2021-05-03,好好吃  性价比高  和舍友经常去吃  强烈推荐 环境也很好 还可以免费加饭  阿姨也很好 冲冲冲冲冲冲冲冲冲冲冲冲冲冲冲冲冲！！！！！！！！！！！！！！！！！！！！！！！！！！！！！！！！！！！！！！！！！！！！！！！！,20元代金券1张，可叠加2张,OOOOOOOOOOOOOOOOOOOOOOOOOOOOOOOOOOOOOOOOOOOOOOOOOOOOOOOOOOOOOOOOOOOOOOOOOOOOOOOOOOOOOOOOOOOOOOOOOOOOOOOOOOOOOOO
4610,茂名,爵士厚牛排自助餐馆（汇丰店）,2021-05-03,经常去吃，现在没以前那么多品种了.有时吃完了很久都没上新的.,火焰牛排1份，有赠品,OOOOOOOOOOOOOOOOOOOOOOOOOOOOOO
4611,茂名,相聚时光（化州店）,2021-05-03,【口味】不错【环境】可以【服务】很好,100元代金券1张，可叠加,OOOOOOOOOOOOOOOOOO
4612,茂名,江渔儿酸菜鱼（高州店）,2021-05-03,常去吃。很喜欢！味道好，环境也很好,除酒水外全场通用,OOOOOOOOOOOOOOOOO
4613,茂名,顺德火焰醉鹅坊（站北五路店）,2021-05-03,值得拥有，非常喜欢,3-4人火锅套餐,OOOOOOOOO
4614,茂名,顺德火焰醉鹅坊（站北五路店）,2021-05-03,好吃推荐这家噢！！！！！！,2人醉鹅火锅套餐,OOOOOOOOOOOOO
4615,茂名,优悦西餐厅（维斯顿店）,2021-05-03,回头客了。第四次关顾。牛眼很肥嫩，上次给朋友点的那款忘记是#套餐：高级2人扒餐哪款了。很好吃！西多士建议不要，性价比不高。也不好吃。,高级2人扒餐，提供免费WiFi,OOOOOOOOOOOOOOOOOOOOOOOOOOOOOOOOOOOOOOOOOOOOOOOOOOOOOOOOOOOOOOOOOO
4616,茂名,十七门重庆老火锅（电白万达店）,2021-05-03,挺不错的的  下次可能还会继续去,100元代金券1张，可叠加2张,OOOOOOOOOOOOOOOO
4617,茂名,十七门重庆老火锅（电白万达店）,2021-05-03,挺不错的的  下次可能还会继续去,100元代金券1张，可叠加2张,OOOOOOOOOOOOOOOO
4618,茂名,真功夫（传湾新天地店）,2021-05-03,【性价比】很高，很实惠。【服务】服务态度好，上菜迅速【环境】环境还可以【口味】有点少辣，开胃可口，还加了一个外婆菜，送饭很香。蒸蛋很滑口，小孩子吃的话特别适合。菜品比较卫生干净，总得来说还是比较方便的。,鱼香茄子饭+香滑蒸蛋1份,OOOOOOOOOOOOOOOOOOOOOOOOOOOOOOOOOOOOOOOOOOOOOOOOOOOOOOOOOOOOOOOOOOOOOOOOOOOOOOOOOOOOOOOOOOOOOOOOOOOOO
4619,茂名,真功夫（传湾新天地店）,2021-05-03,#套餐：【标配】冬菇鸡腿肉饭+香滑蒸蛋【口味】清淡可口，鸡肉非常弹滑，蒸蛋加了肉碎，营养可口。【环境】干净整洁【服务】服务态度好，上菜快速【性价比】实惠价，大众能接受的价格，菜品新鲜，体验感不错。适合带小朋友来吃。,冬菇鸡腿肉饭+香滑蒸蛋1份,OOOOOOOOOOOOOOOOOOOOOOOOOOOOOOOOOOOOOOOOOOOOOOOOOOOOOOOOOOOOOOOOOOOOOOOOOOOOOOOOOOOOOOOOOOOOOOOOOOOOOOOOOOO
4620,茂名,LINLEE·手打柠檬茶（文创店）,2021-05-04,味道还不错,鄰里招牌柠檬茶2选1,OOOOO
4621,茂名,椒王火锅（电白店）,2021-05-04,此次用餐总体来说不错，觉得比较认可的地方有：服务、团购接待、性价比。,100元代金券1张，可叠加2张,OOOOOOOOOOOOOOOOOOOOOOOOOOOOOOOOOO
4622,茂名,椒王火锅（电白店）,2021-05-04,不错,100元代金券1张，可叠加,OO
4623,茂名,源丰唐茶楼（电白万达广场店）,2021-05-04,在万达旁边，过了万达再走1公里左右到了，是在2楼的，一不小心从后门上去了，还奇怪怎么正门跟后厨在一个地方呢我们去的早，晚饭7点左右吧，人不多，里面很大，很多桌子，服务挺好的，灯光稍微暗了一点，点了好多样菜都很好吃，特别是韭菜饺，吃着口感润润的，不会干，味道非常好，吃过那么多发现他们家的好吃，老妈说韭菜饺里面有虾仁，还有金钱肚啊，凤爪啊，炒粉啊，姜汁糕，虾饺（小孩爱吃点了3笼）核桃包等等都挺好吃的，个人觉得比安泰的还要好，就那个栗子饺不好吃，板栗“生水”的，太硬太干而且没有香味，不好吃，如果换成粒上皇那种绵绵香香的板栗，估计会是大惊喜,100元代金券1张，可叠加2张,OOOOOOOOOOOOOOOOOOOOOOOOOOOOOOOOOOOOOOOOOOOOOOOOOOOOOOOOOOOOOOOOOOOOOOOOOOOOOOOOOOOOOOOOOOOOOOOOOOOOOOOOOOOOOOOOOOOOOOOOOOOOOOOOOOOOOOOOOOOOOOOOOOOOOOOOOOOOOOOOOOOOOOOOOOOOOOOOOOOOOOOOOOOOOOOOOOOOOOOOOOOOOOOOOOOOOOOOOOOOOOOOOOOOOOOOOOOOOOOOOOOOOOOOOOOOOOOOOOOOOOOOOOOOO
4624,茂名,爵士厚牛排自助餐馆（汇丰店）,2021-05-04,第三次带全家人过来吃牛排自助餐，今天来的比较晚，差不多三点钟了，菜呢？很少了，我跟服务员和经理反映了之后，他们就播了菜品上来，但是四点钟过后补上来的菜品更多，其实他是分两班的，两点半之前是一般四点钟之后是一班，所以，想知道菜品齐全的自助餐的可以在中午一点钟和下午四点半过来，这个时候的菜品是很齐全的，很新鲜的,火焰牛排1份，有赠品,OOOOOOOOOOBIOOOOOOOOOOOOOOOOOOOOOOOOOOOOOOOOOOOOOOOOOOOOOOOOOOOOOOOOOOOOOOOOOOOOOOOOOOOOOOOOOOOOOOOOOOOOOOOOOOOOOOOOOOOOOOOOOOOOOOOOOOOOOOOOOOOOOOOOOOOOOO
4625,茂名,果之度（开发区店）,2021-05-04,一直都是喜欢榴莲千层蛋糕，所以呢，还可以味道，如果还多点榴莲，少一点奶油的话，会更好吃，怎么评论，得了那么多字啊，为了拿这些积分真的很不容易几个亿以写多几个字，罗嗦一点，了，这也是没有办法的事情，等等一下，看有没有图片咯,榴莲千层蛋糕1个，约3磅，圆,OOOOOOBIIIOOOOOOOOOOOOOOOOOOOOOOOOBIOOOOOOOOOOOOOOOOOOOOOOOOOOOOOOOOOOOOOOOOOOOOOOOOOOOOOOOOOOOOOOOOOOOOOOOOOO
4626,茂名,鲜饮时光（高州店）,2021-05-04,二楼雅座很舒服，东西很合胃口！可以去试试,独享寿司单人餐+饮品1杯，可免费使用包间,OOOOOOOOOOOOOOOOOOOO
4627,茂名,鲜饮时光（高州店）,2021-05-04,价格实惠，用餐舒服，有空调值得一去,尝鲜单人餐，可免费使用包间,OOOOOOOOOOOOOOOOO
4628,茂名,鲜饮时光（高州店）,2021-05-04,很美味的食物，寿司很好吃，服务人员很好,独享寿司单人餐+饮品1杯，可免费使用包间,OOOOOOOBIOOOOOOOOOO
4629,茂名,相聚时光（化州店）,2021-05-04,没什么特别的，一般吧没什么特别的，一般吧没什么特别的，一般吧没什么特别的，一般吧,主食4选1，提供免费WiFi,OOOOOOOOOOOOOOOOOOOOOOOOOOOOOOOOOOOOOOOO
4630,茂名,相聚时光（化州店）,2021-05-04,一般般没什么特别的，一般吧没什么特别的，一般吧,主食4选1，提供免费WiFi,OOOOOOOOOOOOOOOOOOOOOOO
4631,茂名,顺德火焰醉鹅坊（站北五路店）,2021-05-04,味道一般，很油腻，夏天来吃非常的热，不知道哪来的这么多好评。,3-4人火锅套餐,OOOOOOOOOOOOOOOOOOOOOOOOOOOOOO
4632,茂名,付记·招牌酸菜鱼,2021-05-04,酸菜鱼好吃，老板娘也靓，店铺环境好，性价比高,招牌酸菜鱼+香米饭1份，包间免费,OOOOOOOOOOOOOOOOOOOOOO
4633,茂名,菠斯蒂蛋糕,2021-05-04,服务态度好，蛋糕口味好吃，分量也很足,水果布丁1个，约1磅，圆,OOOOOOOOOOOOOOOOOO
4634,茂名,遇见桃园烤鱼（新福路店）,2021-05-05,味道很不错 服务态度好  下次继续来！#套餐：2 人招牌香辣鸡煲套餐,香辣小龙虾套餐，建议2人使用,OOOOOOOOOOOOOOOOOOOOOOOOOOOOOOOOOO
