餐饮评论ID,城市,餐饮名称,评论日期,评论内容,标题,实体编码
6056,茂名,街头牛排（光华北路店）,2021-07-28,一分钱一分货，快餐食品，离牛排有点距离,精致单人套餐，提供免费WiFi,OOOOOOOOOOOOOBIOOOO
6057,茂名,椒王火锅（电白店）,2021-07-28,给蜡笔小新好评,100元代金券1张，可叠加,OOOOOOO
6058,茂名,椒王火锅（电白店）,2021-07-28,服务不错，味道没有重庆火锅的感觉,100元代金券1张，可叠加,OOOOOOOOOOOOOOOO
6059,茂名,贵族自助牛排餐厅（华侨城店）,2021-07-29,种类不是很多，有些菜品不够新鲜，总体来讲还行,贵族自助牛排套餐，建议单人使用,OOOOOOOOOOOOOOOOOOOOOO
6060,茂名,大赞∙炙烧寿司（万达广场店）,2021-07-29,用餐环境卫生，服务态度很好，产品出品很好。推荐,经典单人套餐，提供免费WiFi,OOOOOOOOOOOOOOOOOOOOOOO
6061,茂名,相聚时光（化州店）,2021-07-29,很好很好很好。。。。。。。。。。。。。。。。。。。。。。。。。。。。。。。。。。。。。。。。。。。。。。。。。。。。。。。。。。。。。。。。。。。。。。。。。。。。。。。。。。。。。。。。。。。。。。,单人套餐，提供免费WiFi,OOOOOOOOOOOOOOOOOOOOOOOOOOOOOOOOOOOOOOOOOOOOOOOOOOOOOOOOOOOOOOOOOOOOOOOOOOOOOOOOOOOOOOOOOOOOOOOOOOOO
6062,茂名,友情有意音乐餐厅,2021-07-29,很好很好很好。。。。。。。。。。。。。。。。。。。。。。。。。。。。。。。。。。。。。。。。。。。。。。。。。。。。。。。。。。。。。。。。。。。。。。。。。。。。。。。。。。。。。。。。。。。。。。,榴莲套餐，建议2人使用,OOOOOOOOOOOOOOOOOOOOOOOOOOOOOOOOOOOOOOOOOOOOOOOOOOOOOOOOOOOOOOOOOOOOOOOOOOOOOOOOOOOOOOOOOOOOOOOOOOOO
6063,茂名,源丰唐茶楼（电白万达广场店）,2021-07-29,份量很足，口味不错，特别是虾饺,100元代金券1张，可叠加2张,OOOOOOOOOOOOOOO
6064,茂名,付记·招牌酸菜鱼,2021-07-29,不知道你们为什么觉得好吃，清水汤+好多油。鱼超多刺。要是换白汤底或者好很多,招牌酸菜鱼+香米饭1份，包间免费,OOOOOOOOOOOOOOOOOOOOOOOOOOOOOOOOOOOOO
6065,茂名,法兰度航空主题餐厅（东汇城店）,2021-07-29,在美团上团的套餐，超级划算，餐厅环境不错，也很干净，菜的味道也很好，牛排都是原切的，全熟也非常嫩滑！雪糕也好好吃！服务员的态度很好，上菜速度很快！孩子们都赞不绝口！坐了头等舱！要我五星好评！下次还会来。,精品浪漫双人餐1份,OOOOOOOOOOOOOOOOOOOOOOOOOOOOOOOOOOBIOOOOOOOOOOOOOOOOOOOOOOOOOOOOOOOOOOOOOOOOOOOOOOOOOOOOOOOOOOOOOOOOO
6066,茂名,二月时光烘焙坊（华夏世纪花园店）,2021-07-29,太小了了 其他的还好吧,6英寸摆件蛋糕1个，约6英寸，圆形,OOOOOOOOOOO
6067,茂名,麦壳西点（开发区店）,2021-07-29,很好，蛋糕实惠，里面水果多，而且水果也不酸，吃起来甜而不腻，非常棒！,芒果蛋糕1个，约6英寸，圆形,OOOOOOOOOOOOOOOOOOOOOOOOOOOOOOOOOO
6068,茂名,至尊比萨（电城旗舰店）,2021-07-29,口味的话还不错，价格也实惠，服务人员蛮好的。,一人食比萨套餐（8英寸）,OOOOOOOOOOOOOOOOOOOOOO
6069,茂名,十七门重庆老火锅（电白万达店）,2021-07-29,非常不错的一个地方…服务态度很好…直得再次过来,100元代金券1张，可叠加2张,OOOOOOOOOOOOOOOOOOOOOOO
6070,茂名,入火韩国烤肉（华侨城店）,2021-07-29,#套餐：2-3 人超值全天烤肉套餐简简单单，因为去之前吃了份河粉。结束的打包了。九宫格能免费续，我不清楚，所以我吃了爱吃的。剩了一些。好多配菜，胡萝卜，青柠片，我都不懂怎么吃，这是个人问题。我没有做好攻略来吃，只是传统的生菜夹肉，食材都是新鲜的。,超值全天烤肉套餐，建议2-3人使用,OOOOOOOOOOOOOOOOOOOOOOOOOOOOOOOOOOOOOOOOOOOOOOOOOOOOOOOOOOOOOOOOOOOOOOOOOOOOOOOOOOOOOOOOOOOOOOOOOOOOOOOOOOOOOOOOOOOOOOOOOOO
6071,茂名,油校西餐厅（光遇·油校光华校区店）,2021-07-29,超级好吃，超大份量#套餐：浪漫双人套餐好吃不贵,浪漫双人套餐，提供免费WiFi,OOOOOOOOOOOOOOOOOOOOOOO
6072,茂名,椒王火锅（电白店）,2021-07-29,给蜡笔小新好评,100元代金券1张，可叠加,OOOOOOO
6073,茂名,LINLEE·手打柠檬茶（文创店）,2021-07-30,很满意的一次就餐体验，整体评价的话我觉得：口味。很香，超喜欢喝,鄰里招牌柠檬茶2选1,OOOOOOOOOOOOOOOOOOOOOOOOOOOOOOO
6074,茂名,贵族自助牛排餐厅（华侨城店）,2021-07-30,不错，菜色很多，不断上新，价钱还算合理！蓝色衣服的小姐姐服务很好，一万个赞！,贵族自助牛排套餐，建议单人使用,OOOOOOOOOOOOOOOOOOOOOOOOOOOOOOOOOOOOOO
6075,茂名,贵族自助牛排餐厅（华侨城店）,2021-07-30,愉快的用餐体验，小姐姐会热心提醒客人上菜了，很惊喜哦,贵族自助牛排套餐，建议单人使用,OOOOOOOOOOOOOOOOOOOOOOOOOO
6076,茂名,悦创小鹅鹅桂林米粉（双山一路店）,2021-07-30,又来了第二次尝试啦，环境一如既往地干净清新甚至比上次更整洁啦，桌子上都没有杂物了！看得胃口都好好好。夸一句，粉的软硬度刚刚好！我真的真的真的很不喜欢拍照下图也是凑图啦整体体验+10分噢（我感觉会）,招牌锅烧桂林米粉1份，包间免费,OOOOOOOOOOOOOOOOOOOOOOOOOOOOOOOOOOOOOOOOOOOOOOOOOOOOOOOOOOOOOOOOOOOOOOOOOOOOOOOOOOOOOOOOOOOOOOOOOO
6077,茂名,贵族自助牛排餐厅（华侨城店）,2021-07-30,添菜挺及时的，服务态度挺好的,贵族自助牛排套餐，建议单人使用,OOOOOOOOOOOOOO
6078,茂名,大赞∙炙烧寿司（万达广场店）,2021-07-30,此次用餐总体来说不错，觉得比较认可的地方有：口味、环境、性价比、服务、团购接待。,经典单人套餐，提供免费WiFi,OOOOOOOOOOOOOOOOOOOOOOOOOOOOOOOOOOOOOOOO
6079,茂名,大赞∙炙烧寿司（万达广场店）,2021-07-30,味道挺好就是蓝色衣服服务员助理服务态度有点差，没什么耐心，给客人的感觉就很无奈，影响食欲,大赞双人套餐，提供免费WiFi,OOOOOOOOOOOOOOOOOOOOOOOOOOOOOOOOOOOOOOOOOOOO
6080,茂名,相聚时光（化州店）,2021-07-30,口感不错，2个人吃得很饱，水果也是比较新鲜的,双人牛扒套餐，可免费使用包间,OOOOOOOOOOOOOOOOOOOOOO
6081,茂名,相聚时光（化州店）,2021-07-30,好吃,单人餐，可免费使用包间,OO
6082,茂名,付记·招牌酸菜鱼,2021-07-30,图与食物是不符合的，没拍到图，但是可以说味道【口味】味道还行，汤可以，就是肉太少，那个肥牛，真的少的可怜，而且鱼肉占的骨头比较多，【环境】还行，挺大的，啥都有，齐全【服务】还行，有点耐心吧，等菜偏久【性价比】一般,20元代金券1张，可叠加2张,OOOOOOOOOOOOOOOOOOOOOOOOOOOOOOOOOOOOOOOOOOOOOOOOOOOOOOOOOOOOOOOOOOOOOOOOOOOOOOOOOOOOOOOOOOOOOOOOOOOOOOOOOO
6083,茂名,友情有意音乐餐厅,2021-07-30,服务，用餐环境，菜品味道，值得推荐,豪华双人套餐，可免费使用包间,OOOOOOOOOOOOOOOOO
6084,茂名,法兰度航空主题餐厅（东汇城店）,2021-07-30,味道好极了,精品浪漫双人餐1份,OOOOO
6085,茂名,贤合庄卤味火锅（电白万达店）,2021-07-30,分量也少，味道很一般，服务也很一般,鸭血（可与代金券一起用）1份,OOOOOOOOOOOOOOOOO
6086,茂名,贤合庄卤味火锅（电白万达店）,2021-07-30,合我胃口,50元代金券1张，可叠加,OOOO
6087,茂名,麦壳西点（开发区店）,2021-07-30,挺好吃的耶！而且店家人也很好推荐推荐下次要试试奥利奥口味的！,4英寸便当蛋糕1份,OOOOOOOOOOOOOOOOOOOOOOOOOOOOOO
6088,茂名,优悦西餐厅（维斯顿店）,2021-07-30,环境很好，东西很好吃哦，服务态度很好啊，满足下次还会过来,高级2人扒餐，提供免费WiFi,OOOOOOOOOOOOOOOOOOOOOOOOOOOO
6089,茂名,渔乐码头烤鱼牛蛙晚饭餐厅,2021-07-30,不新鲜的感觉牛蛙有点异味。。。。。。。。。。。,撸蛙双人餐，提供免费WiFi,OOOOOOOOOOOOOOOOOOOOOOO
6090,茂名,草原郎烤羊,2021-07-30,真的呵呵，难吃算了，态度又矛好,现烤羊肉乌苏套餐，建议4人使用,OOOOOOOOOOOOOOO
6091,茂名,优之品西点,2021-07-30,不错,蛋糕8选1,OO
6092,茂名,肯德基（茂名官渡店）,2021-07-30,还不错,666九龙金玉珍珠奶茶兑换券1杯,OOO
6093,茂名,椒王火锅（电白店）,2021-07-30,世界和平,50元代金券1张，仅限使用1张,OOOO
6094,茂名,椒王火锅（电白店）,2021-07-30,好吃,100元代金券1张，可叠加,OO
6095,茂名,入火韩国烤肉（华侨城店）,2021-07-31,#套餐：2-3 人超值全天烤肉套餐烤肉很好吃帮忙烤肉的小哥哥很帅 很好,超值全天烤肉套餐，建议2-3人使用,OOOOOOOOOOOOOOOOOOOOOOOOOOOOOOOOOOO
6096,茂名,相聚时光（化州店）,2021-07-31,很满意的一次就餐体验，整体评价的话我觉得：环境。,饮品2选1，可免费使用包间,OOOOOOOOOOOOOOOOOOOOOOOO
6097,茂名,相聚时光（化州店）,2021-07-31,好好,牛肉肠仔披萨1份，可免费使用包间,OO
6098,茂名,二月时光烘焙坊（华夏世纪花园店）,2021-07-31,蛋糕很好吃，比想象中的好看，性价比高，店家的服务态度很好，也很有礼貌，下次还会在这家订蛋糕！,6英寸草莓ins风1个，约6英寸，圆形,OOOOOOOOOOOOOOOOOOOOOOOOOOOOOOOOOOOOOOOOOOOOOO
6099,茂名,友情有意音乐餐厅,2021-07-31,小孩子居多，环境比较吵。炒饭不错，其他一般吧。,豪华双人套餐，可免费使用包间,OOOOOOOOOOOOOOOOOOOOOOO
6100,茂名,爵士厚牛排自助餐馆（汇丰店）,2021-07-31,值得一去，菜式比较丰富，环境比较好,火焰牛排1份，有赠品,OOOOOOOOOOOOOOOOO
6101,茂名,优乐堡（开发区店）,2021-07-31,总得来说很实惠了。但是店家态度我还觉得要改进。,汉堡+鸡腿套餐，建议单人使用,OOOOOOOOOOOOOOOOOOOOOOO
6102,茂名,优乐堡（开发区店）,2021-07-31,少给了一个汉堡，不检查就打包了，服务一般,20150925全家福套餐，建议3人使用,OOOOOOOOOOOOOOOOOOOO
6103,茂名,麦当劳（明湖店）,2021-07-31,此次用餐总体来说不错，觉得比较认可的地方有：环境。,麦辣鸡翅大套餐1份,OOOOOOOOOOOOOOOOOOOOOOOOO
6104,茂名,贤合庄卤味火锅（电白万达店）,2021-07-31,第一次来，也是最后一次，谁来谁后悔,50元代金券1张，可叠加,OOOOOOOOOOOOOOOOO
6105,茂名,优悦西餐厅（维斯顿店）,2021-07-31,菜品味道不错，环境优美,精致享受单人餐，提供免费WiFi,OOOOOOOOOOO
6106,茂名,草原郎烤羊,2021-07-31,可以哦，味道还不错 羊肉是真的，推荐一下,现烤羊肉乌苏套餐，建议6人使用,OOOOOOOOOOOOOOOOOOOO
6107,茂名,围炉海鲜烤肉自助（金港湾店）,2021-07-31,服务态度好，用餐环境好，菜品口味可以，主要是吃得开心,工作日午餐,OOOOOOOOOOOOOOOOOOOOOOOOOO
6108,茂名,围炉海鲜烤肉自助（金港湾店）,2021-07-31,非常好吃，小朋友们也很喜欢吃,工作日午餐,OOOOOOOOOOOOOO
6109,茂名,椒王火锅（电白店）,2021-07-31,朋友过来说想吃椒王的火锅，过来一试味道确实不错，菌菇汤实在太美味了，都喝了好几碗，朋友还说是来吃火锅的还是来喝汤的下次还会再来哦,100元代金券1张，可叠加,OOOOOOOOOOOOOOOOOOOOOOOOOOOOOOOOOOOOOOOOOOOOOOOOOOOOOOOOOOOOOOOO
6110,茂名,真功夫（传湾新天地店）,2021-07-31,看图就知，实在差太差了，应该不是连锁店,鱼香茄子饭+香滑蒸蛋1份,OOOOOOOOOOOOOOOOOOO
6111,茂名,椒王火锅（电白店）,2021-07-31,服务态度超级好，汤底味道不错，还有要给那个服务员犬夜叉一个大大的好评，还有门迎小哥哥武则天一个好评哦，态度超好哒！,椒家佳品肥牛1份，包间免费,OOOOOOOOOOOOOOOOOOOOOOOOOOOOOOOOOOOOOOOOOOOOOOOOOOOOOOOOO
6112,茂名,椒王火锅（电白店）,2021-07-31,这次就餐整体感觉很赞，比较满意的方面有：口味、环境、性价比、团购接待、服务。蜡笔小新好,100元代金券1张，可叠加,OOOOOOOOOOOOOOOOOOOOOOOOOOOOOOOOOOOOOOOOOOO
6113,茂名,椒王火锅（电白店）,2021-07-31,就是有点贵，量少,100元代金券1张，可叠加,OOOOOOOO
6114,茂名,真功夫（传湾新天地店）,2021-07-31,服务态度差体验极差。。。。。，，,排骨拼鸡腿肉饭+冬(香)菇鸡腿肉饭+四季猪骨汤+金杏蜜桃汁+香滑蒸蛋*2+黄金蛋饺1份,OOOOOOOOOOOOOOOO
6115,茂名,油校西餐厅（光遇·油校光华校区店）,2021-07-31,#套餐：双人鸡扒套餐味道还是不错的，适合和朋友家人去吃，实惠，性价比高，非常推荐，不过柠乐好像喝起来没有那么爽,双人鸡扒套餐，提供免费WiFi,OOOOOOOOOOOOOOOOOOOOOOOOOOOOOOOOOOOOOOOOOOOOOOOOOOOOOOO
6116,茂名,入火韩国烤肉（华侨城店）,2021-08-01,此次用餐总体来说不错，觉得比较认可的地方有：环境、口味。,超值午市套餐，建议2人使用,OOOOOOOOOOOOOOOOOOOOOOOOOOOO
6117,茂名,友情有意音乐餐厅,2021-08-01,这家店非常不错，是个每个家庭去的好地方，环境很优雅，工作人员每一个都很热情，随叫随到。首先极了一个就是味道非常棒，这个味道很好。从从美团购买的套餐非常不错。觉得这个鱼有点小。四个人吃不太够了！还有米饭，觉得好贵哟，三块钱一小碗。,青江鱼烤鱼套餐（包含配菜）口味：香辣-蒜香-酸菜1份,OOOOOOOOOOOOOOOOOOOOOOOOOOOOOOOOOOOOOOOOOOOOOOOOOOOOOOOOOOOOOOOOOOOOOOOOOOOOOOOOOOOOOOOOOOOOOOOOOOBIOOOOOOOOOOOOOO
6118,茂名,相聚时光（化州店）,2021-08-01,味道好，下次再来,牛肉肠仔披萨1份，可免费使用包间,OOOOOOOO
6119,茂名,云南过桥米线（汇景店）,2021-08-01,不错,云南小锅米线1份,OO
6120,茂名,源丰唐茶楼（电白万达广场店）,2021-08-01,非常好吃   地方很大 上菜贼快，东西很新鲜，重要是好吃，姐妹们，冲!,100元代金券1张，可叠加,OOOOOOOOOOOOOOOOOOOOOOOOOOOOOOOOOOO
6121,茂名,爵士厚牛排自助餐馆（汇丰店）,2021-08-01,牛肉火候不错，好吃适合带孩子一家出来聚餐,火焰牛排1份，有赠品,BIOOOOOOOOOOOOOOOOOO
6122,茂名,二月时光烘焙坊（华夏世纪花园店）,2021-08-01,跟我想要的原图一样,6英寸草莓ins风1个，约6英寸，圆形,OOOOOOOOO
6123,茂名,江渔儿酸菜鱼（高州店）,2021-08-01,菜好食，服务好，环境也不错，特别是酸菜鱼，又酸又辣。,除酒水外全场通用,OOOOOOOOOOOOOOOOOOOOOOOOOO
6124,茂名,瀛食精致料理,2021-08-01,味道不错，下次还会再来。特别是土豆泥，很好吃。,芝士焗土豆，建议单人使用,OOOOOOOOOOOOOOOOOOOOOOO
6125,茂名,顺德火焰醉鹅坊（站北五路店）,2021-08-01,#套餐：6 人套餐鹅的份量足够食，服务卫生也不错，味道也合适，就是停车位置小了点点。还欠58个字，，，，，，，，，，，，，，，，，，，，，，，，，，，，，，，，，，，，，，，，，，，，，，，，，，，，！！！！,6人套餐，提供免费WiFi,OOOOOOOOOOOOOOOOOOOOOOOOOOOOOOOOOOOOOOOOOOOOOOOOOOOOOOOOOOOOOOOOOOOOOOOOOOOOOOOOOOOOOOOOOOOOOOOOOOOOOOOO
6126,茂名,江渔儿酸菜鱼（高州店）,2021-08-01,好好吃#套餐：酸菜鱼双人餐,酸菜鱼双人餐,OOOOOOOOOOOOO
6127,茂名,围炉海鲜烤肉自助（金港湾店）,2021-08-01,太好吃了干净整洁舒适，还有音乐听，服务态度非常好，一进门就招待我们了，把我们安排到桌子，菜非常不错，小料也不错，还有意大利粉不错的，甜品水果都很新鲜，特别肥牛最好吃，很多人抢购，我们最喜欢吃这个，每次来吃自助餐都少不了肥牛,晚餐/节假日全天,OOOOOOOOOOOOOOOOOOOOOOOOOOOOOOOOOOOOOOOOOOOOOOOOOOOOOOOOOOOOOOOOOOBIOOOOOOOOOOOOOOOOOOOOOOOOOOOOOOOOOOOOOOOOOOO
6128,茂名,冲天香鸭粥店（光华北店）,2021-08-01,相对来讲中规中矩，没有太大惊喜，优惠券的时间太尴尬了，希望可以延长用券的时间……,2-3人鸭粥套餐,OOOOOOOOOOOOOOOOOOOOOOOOOOOOOOOOOOOOOOOO
6129,茂名,遇见桃园烤鱼（新福路店）,2021-08-01,非常好吃，性价比超高，口味符合大众口味，老板态度好，店员长得帅气，环境不错，有空调舒服，唯一不足忘了吃前拍照了,桃园烤鱼抢购套餐，建议4人使用,OOOOOOOOOOOOOOOOOOOOOOOOOOOOOOOOOOOOOOOOOOOOOOOOOOOOOOO
6130,茂名,果之度（为民店）,2021-08-01,榴莲千层蛋糕忘记买多少钱了，不过价格挺优惠的。榴莲味虽然没那么重没那么香，但是料全部裹满千层内，吃起来挺好吃的下次还会回购。吃过几家店的榴莲千层蛋糕，在价格上，这家店算性价比高的，做得也好吃些。,榴莲千层切件蛋糕1件,BIIIOOOOOOOOOOOOOOOOOOOOOOOOOOOOOOOOOOOOOOOOOOOOOOOOOOOOOOOOOOOOOOOOBIIIOOOOOOOOOOOOOOOOOOOOOOOOO
6131,茂名,遇见桃园烤鱼（新福路店）,2021-08-01,这次消费总体来说比较一般，提几点问题吧：口味不好，希望店家能有所改善。酱香味好咸，希望淡一点,豪华烤鱼抢购套餐，建议4人使用,OOOOOOOOOOOOOOOOOOOOOOOOOOOOOOOOOOOOOOOOOOOOOO
6132,茂名,喜姐炸串（新天地店）,2021-08-01,#套餐：脆皮水磨年糕好吃好吃()【环境】干净整洁。【服务】服务很好很周到，小姐姐也很热情。【性价比】蛮高的，很实惠，实物与图片相符不错不错*^O^*【口味】真的好好吃，脆皮年糕，酱料也很足很香很喜欢吃，里面糯叽叽的。,脆皮水磨年糕1串,OOOOOOOOOOOOOOOOOOOOOOOOOOOOOOOOOOOOOOOOOOOOOOOOOOOOOOOOOOOOOOOOOOOOOOOOOOOOOOOOOOOOOOOOOOOOOOOOOOOOOOOOOOOO
6133,茂名,油校西餐厅（光遇·油校光华校区店）,2021-08-02,东西还行，就是到了那里服务员啥也没说，就拿了柠檬水倒了就走回前台。,双人鸡扒套餐，提供免费WiFi,OOOOOOOOOOOOOOOOOOOOOOOOOOOOOOOOO
6134,茂名,油校西餐厅（光遇·油校光华校区店）,2021-08-02,非常好吃，推荐大家来，朋友聚会啥的都很合适，价格亲民，非常好吃，冲冲冲冲！！,单人黑椒鸡扒套餐,OOOOOOOOOOOOOOOOOOOOOOOOOOOOOOOOOOOOOO
6135,茂名,相聚时光（化州店）,2021-08-02,虽然来这吃很多次，都没有评价。但这是纸包鱼必须评价给个赞。鱼够入味，刚刚好，配菜丰富，分量十足。比某店专门做纸包鱼的还要好吃！位置好找，停车也不难。如果可以设一个吸烟区会不会更加人性化化？总的来说，很好。,相聚时光纸上包鱼，建议2人使用，可免费使用包间,OOOOOOOOOOOOOOOOOOOOOOOOOOOOOOOOOOOOOOOOOOOOOOOOOOOOOOOOOOOOOOOOOOOOOOOOOOOOOOOOOOOOOOOOOOOOOOOOOOOOOO
6136,茂名,相聚时光（化州店）,2021-08-02,好吃，下次再来,主食4选1，提供免费WiFi,OOOOOOO
6137,茂名,付记·招牌酸菜鱼,2021-08-02,此次用餐总体来说不错，觉得比较认可的地方有：环境、口味。,招牌酸菜鱼+香米饭1份，包间免费,OOOOOOOOOOOOOOOOOOOOOOOOOOOO
6138,茂名,友情有意音乐餐厅,2021-08-02,没有以前好吃，略带一种粘锅烧焦的味道,超值滑饭饮品套餐，建议单人使用,OOOOOOOOOOOOOOOOOO
6139,茂名,优悦西餐厅（维斯顿店）,2021-08-02,不错，这家餐厅服务很到位，口味也很好，十几分钟就可以上菜了，其他店都要二十三十多分钟。好吃不贵，环境很好，没有人大声喧哗，虽然只去过一次，但是味道令人难忘。直到今天，我还记得那次，去优悦西餐厅里吃西餐。,豪华2人扒餐，提供免费WiFi,OOOOOOOOOOOOOOOOOOOOOOOOOOOOOOOOOOOOOOOOOOOOOOOOOOOOOOOOOOOOOOOOOOOOOOOOOOOOOOOOOOOOOOOOOOOOOOOOOOOOO
6140,茂名,围炉海鲜烤肉自助（金港湾店）,2021-08-02,两口子出来吃饭就来这里了，在高州为数不多菜量多，环境好的餐厅。随便吃快餐也要几十块，在这里有人服务还任食吴嬲！周边设施又齐全吃完刚好可以到商场走走，公园走走，舒服,工作日午餐,OOOOOOOOOOOOOOOOOOOOOOOOOOOOOOOOOOOOOOOOOOOOOOOOOOOOOOOOOOOOOOOOOOOOOOOOOOOOOOOOO
6141,茂名,椒王火锅（电白店）,2021-08-02,佩琪小姐姐，服务很好,椒家佳品肥牛1份，包间免费,OOOOOOOOOO
6142,茂名,入火韩国烤肉（华侨城店）,2021-08-02,第一次吃烤肉，服务员帮忙考的肉，挺好吃的。点了两个套餐，山蒜五花肉，石锅牛肉饭，老奶奶辣年糕，一开始以为4个人吃不饱的来了，结果吃撑了^^。没上菜前差点把配菜吃完了()，还好后面可以续菜，真心不错呢,100元代金券1张，可叠加2张,OOOOOOOOOOOOOOOOOOOOOOOOOOOOOOOOOOOOBIOOOOOOOOOOOOOOOOOOOOOOOOOOOOOOOOOOOOOOOOOOOOOOOOOOOOOOOOOOOOO
6143,茂名,椒王火锅（高州店）,2021-08-02,菌汤很正宗，值得推荐大众友友们,可叠加，除饮料，酒水外全场通用,OOOOOOOOOOOOOOO
6144,茂名,油校西餐厅（光遇·油校光华校区店）,2021-08-03,还不错，那个环境很好，氛围很适合约会，价格优惠，味道也还不错,浪漫双人套餐，提供免费WiFi,OOOOOOOOOOOOOOOOOOOOOOOOOOOOOO
6145,茂名,相聚时光（化州店）,2021-08-03,此次用餐总体来说不错，觉得比较认可的地方有：性价比。,饮品2选1，可免费使用包间,OOOOOOOOOOOOOOOOOOOOOOOOOO
6146,茂名,爵士厚牛排自助餐馆（汇丰店）,2021-08-03,菜式多样，价格还算合理，就是对小孩的定价不够友好，一般去都是带小孩去玩下，并不是为了想食而去，七八岁小孩孩，没吃什么东西，但身高大多都超店家定的身高标准了，按成人标准收费，不合算，少去了，环境还算可以，位置停车不方便,火焰牛排1份，有赠品,OOOOOOOOOOOOOOOOOOOOOOOOOOOOOOOOOOOOOOOOOOOOOOOOOOOOOOOOOOOOOOOOOOOOOOOOOOOOOOOOOOOOOOOOOOOOOOOOOOOOOOOOOOOO
6147,茂名,麦当劳（明湖店）,2021-08-03,666---棒极了，支付宝体验，点餐优惠，高温补贴，折后价才3.25元，美团也有优惠价，666啊！！！666---棒极了，支付宝体验，点餐优惠，高温补贴，折后价才3.25元，美团也有优惠价，666啊！！！,薯条（小）1份,OOOOOOOOOOOOOOOOOOOOOOOOOOOOOOOOOOOOOOOOOOOOOOOOOOOOOOOOOOOOOOOOOOOOOOOOOOOOOOOOOOOOOOOOOOOOOOOOOOOOOO
6148,茂名,盛香烧鹅（东方市场店）,2021-08-03,酸梅汁都没有给，匆匆忙忙就打包好了，失望,主食3选1，有赠品,OOOOOOOOOOOOOOOOOOOO
6149,茂名,贤合庄卤味火锅（电白万达店）,2021-08-03,好,鸭血（可与代金券一起用）1份,O
6150,茂名,贤合庄卤味火锅（电白万达店）,2021-08-03,还不错吧。,50元代金券1张，可叠加,OOOOO
6151,茂名,优悦西餐厅（维斯顿店）,2021-08-03,环境不错，服务态度良好，菜品不错,豪华2人扒餐，提供免费WiFi,OOOOOOOOOOOOOOOO
6152,茂名,围炉海鲜烤肉自助（金港湾店）,2021-08-03,太多好吃的了、菜品也很足，服务也很好、环境干净、真的不错、下次还去吃,晚餐/节假日全天,OOOOOOOOOOOOOOOOOOOOOOOOOOOOOOOOOO
6153,茂名,优悦西餐厅（维斯顿店）,2021-08-03,环境优美，服务态度良好，菜品不错，值得尝试,豪华2人扒餐，提供免费WiFi,OOOOOOOOOOOOOOOOOOOOO
6154,茂名,菠斯蒂蛋糕,2021-08-03,个头有大有小，但是里面的奶油就这么一点点，个人觉得味道不咋滴,泡芙1个，提供免费WiFi,OOOOOOOOOOOOBIOOOOOOOOOOOOOOOO
6155,茂名,冲天香鸭粥店（光华北店）,2021-08-03,#套餐：2-3 人鸭粥套餐好吃，真的好吃，又不贵推荐推荐。大家可以试试。这里的这个小面筋好好吃，感觉比卫龙的还好吃了。又不贵，真的太便宜了，不是假的便宜。【环境】环境也是非常好的，摆放整齐。【服务】服务也是挺好的。,2-3人鸭粥套餐,OOOOOOOOOOOOOOOOOOOOOOOOOOOOOOOOOOOOOOOOOOOOOOOOOOOOOOOOOOOOOOOOOOOOOOOOOOOOOOOOOOOOOOOOOOOOOOOOOOOOOOOOOOO
6156,茂名,优之品西点,2021-08-03,味道不错，大家都很喜欢，价格也很实惠，蛋糕的颜值也高，最重要的是卖家的服务态度超级好,"蛋糕38选1,约8英寸，圆形",OOOOOOOOOOOOOOOOOOOOOOOOOOOOOOOOOOOOOOOOOO
6157,茂名,喜姐炸串（新天地店）,2021-08-03,每次叫外卖，外卖方便点，这次到店购买。在新天地二楼，逗半个圈能找到，服务员小姐姐态度挺好的。臭豆腐不是很臭，闻起来不臭，汤还挺不错，年糕糯糯的，皮炸的脆脆表面涂一层酱料，有点甜甜辣辣，，外面很多座位，比较透气。,脆皮水磨年糕1串,OOOOOOOOOOOOOOOOOOOOOOOOOOOOOOOOOOOOOOOOOOOOOOOOOOOOOOOOOOOOOOOOOOOOOOOOOOOOOOOOOOOOOOOOOOOOOOOOOOOOOOOOO
6158,茂名,遇见桃园烤鱼（新福路店）,2021-08-03,#套餐：清蒸生蚝好吃，真的好吃又不贵，吃完还不够推荐推荐。大家可以试试。这里的这个小面筋好好吃，感觉比卫龙的还好吃了。又不贵，真的太便宜了，不是假的便宜。【环境】环境也是非常好的，摆放整齐。【口味】服务也是挺好的。,蒜蓉粉丝扇贝1只,OOOOOOBIOOOOOOOOOOOOOOOOOOOOOOOOOOOOOOOOOOOOOOOOOOOOOOOOOOOOOOOOOOOOOOOOOOOOOOOOOOOOOOOOOOOOOOOOOOOOOOOOOOO
6159,茂名,元晟坊蛋糕（南香公园店）,2021-08-03,味道感觉一般般，环境非常好,便当蛋糕1个，约4英寸，圆形,OOOOOOOOOOOOO
6160,茂名,元晟坊蛋糕（南香公园店）,2021-08-03,挺好吃.,雪媚娘3选2，提供免费WiFi,OOOO
